{
  "schema_version": "2.0",
  "name": "Indie Dance Composition",
  "tempo": 120,
  "time_signature": "4/4",
  "tonic": "D",
  "mode": "ionian",
  "style": "indie_dance",
  "arrangement": {
    "sections": [
      {
        "id": "intro",
        "start_bar": 1,
        "bar_count": 4,
        "energy": 0.5
      },
      {
        "id": "build",
        "start_bar": 5,
        "bar_count": 8,
        "energy": 0.75
      },
      {
        "id": "release",
        "start_bar": 13,
        "bar_count": 4,
        "energy": 1.0
      }
    ],
    "harmony_assignments": []
  },
  "tracks": [
    {
      "id": "melody",
      "type": "pitched",
      "role": "focal_identity",
      "motifs": [
        {
          "id": "phrase1",
          "events": [
            {
              "bar": 1,
              "beat": "1",
              "duration": "1/4",
              "pitches": [
                "D4"
              ],
              "velocity": 96
            },
            {
              "bar": 1,
              "beat": "2",
              "duration": "1/4",
              "pitches": [
                "E4"
              ],
              "velocity": 96
            },
            {
              "bar": 1,
              "beat": "3",
              "duration": "1/4",
              "pitches": [
                "F4"
              ],
              "velocity": 96
            }
          ]
        }
      ],
      "section_assignments": [
        {
          "section_id": "intro",
          "motif_id": "phrase1"
        },
        {
          "section_id": "build",
          "motif_id": "phrase1"
        },
        {
          "section_id": "release",
          "motif_id": "phrase1"
        }
      ]
    },
    {
      "id": "bass",
      "type": "pitched",
      "role": "harmonic_support",
      "motifs": [
        {
          "id": "drone",
          "events": [
            {
              "bar": 1,
              "beat": "1",
              "duration": "1/1",
              "pitches": [
                "D2"
              ],
              "velocity": 72
            }
          ]
        }
      ],
      "section_assignments": [
        {
          "section_id": "intro",
          "motif_id": "drone"
        },
        {
          "section_id": "build",
          "motif_id": "drone"
        },
        {
          "section_id": "release",
          "motif_id": "drone"
        }
      ]
    },
    {
      "id": "drums",
      "type": "drums",
      "role": "groove",
      "motifs": [
        {
          "id": "kick_pattern",
          "events": [
            {
              "bar": 1,
              "beat": "1",
              "duration": "1/4",
              "drum_voice": "kick",
              "velocity": 110
            },
            {
              "bar": 1,
              "beat": "3",
              "duration": "1/4",
              "drum_voice": "snare",
              "velocity": 96
            }
          ]
        }
      ],
      "section_assignments": [
        {
          "section_id": "intro",
          "motif_id": "kick_pattern"
        },
        {
          "section_id": "build",
          "motif_id": "kick_pattern"
        },
        {
          "section_id": "release",
          "motif_id": "kick_pattern"
        }
      ]
    },
    {
      "id": "hi-hats",
      "type": "percussion",
      "role": "textural_layer",
      "motifs": [
        {
          "id": "hi-hat_pattern",
          "events": [
            {
              "bar": 5,
              "beat": "1",
              "duration": "1/8",
              "instrument": "hi-hat",
              "sounding_articulation": "open",
              "velocity": 80
            }
          ]
        }
      ],
      "section_assignments": [
        {
          "section_id": "build",
          "motif_id": "hi-hat_pattern"
        },
        {
          "section_id": "release",
          "motif_id": "hi-hat_pattern"
        }
      ],
      "kit_id": "default_kit",
      "map_id": "default_map"
    }
  ]
}
